id,updateDate,link,category,description,description2,publishDate,deadlineDate,procedure,cat2,cat3,link2,value
"4806248","2021-06-09T09:00:21.858970","https://www.eprocurement.gov.cy/epps/cft/prepareViewCfTWS.do?resourceId=4806248","ΕΦΟΡΕΙΑ ΕΛΛΗΝΙΚΩΝ ΕΚΠΑΙΔΕΥΤΗΡΙΩΝ ΛΑΡΝΑΚΑΣ","Πλειοδοτικός Διαγωνισμός για Διαχείριση και Εκμετάλλευση του Κυλικείου στο Δημοτικό Σχολείο Αγίου Λαζάρου Β΄ Λάρνακας","Πλειοδοτικός Διαγωνισμός για Διαχείριση και Εκμετάλλευση του Κυλικείου στο Δημοτικό Σχολείο Αγίου Λαζάρου Β΄ Λάρνακας","2021-06-09T11:18:17","2021-07-01T12:00:00","Ανοικτή","Υποβολή Προσφοράς","Κάτω","https://www.eprocurement.gov.cy/epps/cft/downloadNoticeForAdvSearch.do?resourceId=4806248","1785"
"4806152","2021-06-09T09:00:21.858970","https://www.eprocurement.gov.cy/epps/cft/prepareViewCfTWS.do?resourceId=4806152","Επαρχιακή Διοίκηση Λευκωσίας","Ε.ΛΕΥ 31/2021 -Διάφορες οικοδομικές εργασίες για την επιδιόρθωση του Κοινοτικού Κτηρίου Αρεδιού στην Επαρχία Λευκωσίας","Ε.ΛΕΥ 31/2021 - Διάφορες οικοδομικές εργασίες για την επιδιόρθωση του Κοινοτικού Κτηρίου Αρεδιού στην Επαρχία Λευκωσίας","2021-06-09T11:16:26","2021-06-25T09:00:00","Ανοικτή","Υποβολή Προσφοράς","Κάτω","https://www.eprocurement.gov.cy/epps/cft/downloadNoticeForAdvSearch.do?resourceId=4806152","34000"
"4805993","2021-06-09T09:00:21.858970","https://www.eprocurement.gov.cy/epps/cft/prepareViewCfTWS.do?resourceId=4805993","Αρχή Ηλεκτρισμού Κύπρου","155/2021 - Supply of Plastic Cable Warning Tape","Supply of Plastic Cable Warning Tape","2021-06-09T11:15:53","2021-07-07T23:45:00","Ανοικτή","Υποβολή Προσφοράς","Κάτω","https://www.eprocurement.gov.cy/epps/cft/downloadNoticeForAdvSearch.do?resourceId=4805993","73500"
"4806554","2021-06-09T10:00:21.651250","https://www.eprocurement.gov.cy/epps/cft/prepareViewCfTWS.do?resourceId=4806554","ΕΦΟΡΕΙΑ ΕΛΛΗΝΙΚΩΝ ΕΚΠΑΙΔΕΥΤΗΡΙΩΝ ΛΑΡΝΑΚΑΣ","Πλειοδοτικός Διαγωνισμός για Διαχείριση και Εκμετάλλευση του Κυλικείου στο Δημοτικό Σχολείο Αγίου Γεωργίου Λάρνακας","Πλειοδοτικός Διαγωνισμός για Διαχείριση και Εκμετάλλευση του Κυλικείου στο Δημοτικό Σχολείο Αγίου Γεωργίου Λάρνακας","2021-06-09T12:23:16","2021-07-01T12:00:00","Ανοικτή","Υποβολή Προσφοράς","Κάτω","https://www.eprocurement.gov.cy/epps/cft/downloadNoticeForAdvSearch.do?resourceId=4806554","2678"
"4806414","2021-06-09T10:00:21.651250","https://www.eprocurement.gov.cy/epps/cft/prepareViewCfTWS.do?resourceId=4806414","Αρχή Ηλεκτρισμού Κύπρου","183 Supply of Chemicals - Chlorine and Limestone-.","Supply of Chemicals - Chlorine and Limestone-.","2021-06-09T12:18:21","2021-07-07T23:45:00","Ανοικτή","Υποβολή Προσφοράς","Κάτω","https://www.eprocurement.gov.cy/epps/cft/downloadNoticeForAdvSearch.do?resourceId=4806414","53000"
"4805607","2021-06-09T10:00:21.651250","https://www.eprocurement.gov.cy/epps/cft/prepareViewCfTWS.do?resourceId=4805607","Τμήμα Δημοσίων Έργων","Πλειοδοτικός Διαγωνισμός για την εκμετάλλευση του κυλικείου του Τμήματος Δημοσίων Έργων, Αρ. Διαγωνισμού: ΚΠΣ/15/2021/Y(A)","Η εκμετάλλευση του κυλικείου στο κυβερνητικό κτίριο όπου στεγάζονται τα Κεντρικά Γραφεία και το Γραφείο του Επαρχιακού Μηχανικού Λευκωσίας του Τμήματος Δημοσίων Έργων","2021-06-09T12:13:47","2021-07-06T11:00:00","Ανοικτή","Υποβολή Προσφοράς","Κάτω","https://www.eprocurement.gov.cy/epps/cft/downloadNoticeForAdvSearch.do?resourceId=4805607","18000"
"4806821","2021-06-09T11:00:22.942691","https://www.eprocurement.gov.cy/epps/cft/prepareViewCfTWS.do?resourceId=4806821","Συμβούλιο Αποχετεύσεων Πάφου","Ψεκασμοί φρεατίων αποχετευτικού συστήματος λυμάτων","παροχή υπηρεσιών για εργασίες ψεκασμών των δημόσιων φρεατίων του αποχετευτικού συστήματος λυμάτων, των ιδιωτικών φρεατίων σύνδεσης","2021-06-09T13:22:47","2021-06-18T12:30:00","Ανοικτή","Υποβολή Προσφοράς","Κάτω","https://www.eprocurement.gov.cy/epps/cft/downloadNoticeForAdvSearch.do?resourceId=4806821","41680"
"4806122","2021-06-09T12:00:22.870438","https://www.eprocurement.gov.cy/epps/cft/prepareViewCfTWS.do?resourceId=4806122","ΙΝΣΤΙΤΟΥΤΟ ΚΥΠΡΟΥ","Μηχανολογικές Εργασίες της Ανακαίνισης, Διαρρύθμισης και Επέκτασης του κτιρίου FRESNEL, CyI/OPER/FresnelRen/Mechanical/2021","Σκοπός της κύριας εργολαβίας είναι η ανακαίνιση και διαμόρφωση υφιστάμενου διώροφου κτιρίου το οποίο περιλαμβάνει κατεδαφίσεις, νέες τοιχοποιίες ξηρής δόμησης, νέες δαπεδοστρώσεις, ψευδοροφές, χρωματισμούς, μεταλλικές κατασκευές, νέα κουφώματα και όλες τις συναφείς ηλεκτρομηχανολογικές και εξωτερικές εργασίες για τις ανάγκες του Ινστιτούτου Κύπρου. Το κτίριο θα περιλαμβάνει εργαστηριακούς και γραφειακούς χώρους. Το συμβόλαιο υπεργολαβίας αφορά την προμήθεια, παράδοση, αποθήκευση, εγκατάσταση, αποπεράτωση και δοκιμή όλων των υλικών και μηχανημάτων των Μηχανολογικών εγκαταστάσεων, σύμφωνα με τα Σχέδια, Πίνακες Μηχανημάτων, Τεχνικές Προδιαγραφές, και όπως οδηγίες Επιβλέποντα Μηχανικού.","2021-06-09T14:48:45","2021-07-12T12:00:00","Ανοικτή","Υποβολή Προσφοράς","Κάτω","https://www.eprocurement.gov.cy/epps/cft/downloadNoticeForAdvSearch.do?resourceId=4806122","125000"
"4807081","2021-06-09T12:00:22.870438","https://www.eprocurement.gov.cy/epps/cft/prepareViewCfTWS.do?resourceId=4807081","Υπουργείο Υγείας","Προσφορά για την προμήθεια Αντιμυκητιασικών Φαρμάκων αρ.διαγ. Φ.Υ.Υ.56/2021 (ΟΑΥ)","Προμήθεια Αντιμυκητιασικών Φαρμάκων","2021-06-09T14:45:03","2021-07-12T13:00:00","Ανοικτή","Υποβολή Προσφοράς","Πάνω","https://www.eprocurement.gov.cy/epps/cft/downloadNoticeForAdvSearch.do?resourceId=4807081","544236"
"4807338","2021-06-09T14:00:28.240420","https://www.eprocurement.gov.cy/epps/cft/prepareViewCfTWS.do?resourceId=4807338","ΙΝΣΤΙΤΟΥΤΟ ΚΥΠΡΟΥ","Ηλεκτρολογικές Εργασίες της Ανακαίνισης, Διαρρύθμισης και Επέκτασης του κτιρίου FRESNEL, CyI/OPER/FresnelRen/Electrical/2021","Σκοπός της κύριας εργολαβίαςείναι η ανακαίνιση και διαμόρφωση υφιστάμενου διώροφου κτιρίου το οποίο περιλαμβάνει κατεδαφίσεις, νέες τοιχοποιίες ξηρής δόμησης, νέες δαπεδοστρώσεις, ψευδοροφές, χρωματισμούς, μεταλλικές κατασκευές, νέα κουφώματα και όλες τις συναφείς ηλεκτρομηχανολογικές και εξωτερικές εργασίες για τις ανάγκες του Ινστιτούτου Κύπρου. Το κτίριο θα περιλαμβάνει εργαστηριακούς και γραφειακούς χώρους. Το συμβόλαιο υπεργολαβίας αφορά την προμήθεια, παράδoση, αποθήκευση, εγκατάσταση, αποπεράτωση, δοκιμή και συντήρηση όλων των υλικών και μηχαvημάτωv για ένα χρόνο από την ημερομηνία παράδοσης των Ηλεκτρολογικών εγκαταστάσεων, συμπεριλαμβανομένων των εξωτερικών εργασιών, σύμφωνα με τα Σχέδια, Πίνακες Διανομής, Τεχνικές Προδιαγραφές, και όπως οδηγίες Επιβλέποντα Μηχανικού. Όλες οι ηλεκτρολογικές εγκαταστάσεις του Έργου θα είναι νέες και θα συνάδουν με το πρότυπο ηλεκτρολογικών εγκαταστάσεων BS7671-A3:2015.","2021-06-09T16:42:06","2021-07-12T12:00:00","Ανοικτή","Υποβολή Προσφοράς","Κάτω","https://www.eprocurement.gov.cy/epps/cft/downloadNoticeForAdvSearch.do?resourceId=4807338","90000"
"4807609","2021-06-10T05:00:18.156623","https://www.eprocurement.gov.cy/epps/cft/prepareViewCfTWS.do?resourceId=4807609","Οργανισμός Κρατικών Υπηρεσιών Υγείας","ΔΙΑΓΩΝΙΣΜΟΣ ΓΙΑ ΤΗ ΠΡΟΜΗΘΕΙΑ ΕΓΚΑΤΑΣΤΑΣΗ ΚΑΙ ΣΥΝΤΗΡΗΣΗ ΣΥΣΤΗΜΑΤΟΣ ΛΙΘΟΘΡYΨΙΑΣ ΜΕ ΛΕΙΖΕΡ ΓΙΑ ΤΙΣ ΑΝΑΓΚΕΣ ΤΗΣ ΟΥΡΟΛΟΓΙΚΗΣ ΚΛΙΝΙΚΗΣ ΤΟΥ Γ.Ν. ΛΑΡΝΑΚΑΣ ΚΑΙ ΠΑΦΟΥ Γ.Τ.123/21","ΔΙΑΓΩΝΙΣΜΟΣ ΓΙΑ ΤΗ ΠΡΟΜΗΘΕΙΑ ΕΓΚΑΤΑΣΤΑΣΗ ΚΑΙ ΣΥΝΤΗΡΗΣΗ ΣΥΣΤΗΜΑΤΟΣ ΛΙΘΟΤΡYΨΙΑΣ ΜΕ ΛΕΙΖΕΡ ΓΙΑ ΤΙΣ ΑΝΑΓΚΕΣ ΤΗΣ ΟΥΡΟΛΟΓΙΚΗΣ ΚΛΙΝΙΚΗΣ ΤΟΥ Γ.Ν. ΛΑΡΝΑΚΑΣ ΚΑΙ ΠΑΦΟΥ Γ.Τ.123/21","2021-06-10T07:48:55","2021-06-24T09:00:00","Ανοικτή","Υποβολή Προσφοράς","Κάτω","https://www.eprocurement.gov.cy/epps/cft/downloadNoticeForAdvSearch.do?resourceId=4807609","208200"
"4807970","2021-06-10T09:00:21.260881","https://www.eprocurement.gov.cy/epps/cft/prepareViewCfTWS.do?resourceId=4807970","Πανεπιστήμιο Κύπρου","UCY-2021-032-ΚΕΜΙ : Αγορά εξειδικευμένου συνεστιακού μικροσκοπίου για τις ανάγκες του Κέντρου Ερευνών Μοριακής Ιατρικής του Πανεπιστήμιου Κύπρου","Η αγορά εξειδικευμένου συνεστιακού μικροσκοπίου για τις ανάγκες του Κέντρου Ερευνών Μοριακής Ιατρικής του Πανεπιστήμιου Κύπρου.","2021-06-10T11:42:23","2021-07-06T12:00:00","Ανοικτή","Υποβολή Προσφοράς","Κάτω","https://www.eprocurement.gov.cy/epps/cft/downloadNoticeForAdvSearch.do?resourceId=4807970","140000"
"4808222","2021-06-10T10:00:23.939744","https://www.eprocurement.gov.cy/epps/cft/prepareViewCfTWS.do?resourceId=4808222","Τμήμα Ηλεκτρομηχανολογικών Υπηρεσιών","Διαγωνισμός Αρ.13.25.002.21.06 για την Προμήθεια Κεντρικών Πινάκων Διανομής Αυτόματων Μεταγωγικών Διακοπτών και Διακοπτών Παράκαμψης για Στρατόπεδα της ΕΦ και Κυβερνητικά Κτίρια","Διαγωνισμός για την προμήθεια κεντρικών πινάκων διανομής αυτόματων μεταγωγικών διακοπτών και διακοπτών παράκαμψης για Στρατόπεδα της ΕΦ και Κυβερνητικά Κτίρια","2021-06-10T12:04:26","2021-07-02T09:00:00","Ανοικτή","Υποβολή Προσφοράς","Κάτω","https://www.eprocurement.gov.cy/epps/cft/downloadNoticeForAdvSearch.do?resourceId=4808222","21500"
"4807395","2021-06-10T11:00:20.286110","https://www.eprocurement.gov.cy/epps/cft/prepareViewCfTWS.do?resourceId=4807395","ΙΝΣΤΙΤΟΥΤΟ ΚΥΠΡΟΥ","Purchase of a micro-computed tomography (microCT) system CyI/STARC/BioMERA/2021","The contract scope is the supply of an X-ray Computed Tomography (XRCT) system together with the software for controlling the hardware and reconstructing the projections acquired. The system will be placed in a X-ray radiation shielded room, provided by the Cyprus Institute. The system must be as flexible as possible, able to adapt to the different experimental needs, and open to possible future upgrades in order to improve its performances in terms of spatial resolution and phase contrast modality implementation.","2021-06-10T13:58:37","2021-07-26T12:00:00","Ανοικτή","Υποβολή Προσφοράς","Πάνω","https://www.eprocurement.gov.cy/epps/cft/downloadNoticeForAdvSearch.do?resourceId=4807395","420000"
"4808878","2021-06-10T11:00:20.286110","https://www.eprocurement.gov.cy/epps/cft/prepareViewCfTWS.do?resourceId=4808878","Κοινοτικό Συμβούλιο Ακακίου","Επέκταση του Υφιστάμενου Κοιμητηριού Ακακίου - Κατασκευαστικές εργασίες (Φάση Α)","Επέκταση του Υφιστάμενου Κοιμητηριού Ακακίου - Κατασκευαστικές εργασίες (Φάση Α)","2021-06-10T13:52:19","2021-07-02T09:00:00","Ανοικτή","Υποβολή Προσφοράς","Κάτω","https://www.eprocurement.gov.cy/epps/cft/downloadNoticeForAdvSearch.do?resourceId=4808878","200000"
"4804276","2021-06-10T11:00:20.286110","https://www.eprocurement.gov.cy/epps/cft/prepareViewCfTWS.do?resourceId=4804276","Τμήμα Δημοσίων Έργων","ΑΝΤΙΚΑΤΑΣΤΑΣΗ ΑΡΜΟΚΑΛΥΠΤΡΩΝ ΣΤΙΣ ΓΕΦΥΡΕΣ ΤΟΥ ΚΟΜΒΟΥ ‘ΡΙΖΟΕΛΙΑΣ’, ΣΤΗΝ ΛΑΡΝΑΚΑ, Δ.Τ.Δ.Ε. (ΕΜ.Λ/ΚΑ) 20/2021.","Αντικατάσταση αρμοκάλυπτρων στις γέφυρες του Κόμβου ‘Ρίζοελιάς’ στην Λάρνακα.","2021-06-10T13:10:07","2021-07-09T11:00:00","Ανοικτή","Υποβολή Προσφοράς","Κάτω","https://www.eprocurement.gov.cy/epps/cft/downloadNoticeForAdvSearch.do?resourceId=4804276","488800"
"4809201","2021-06-10T12:00:22.421467","https://www.eprocurement.gov.cy/epps/cft/prepareViewCfTWS.do?resourceId=4809201","Οργανισμός Κρατικών Υπηρεσιών Υγείας","Διαγωνισμός για την Προμήθεια και Συντήρηση Ασθενοφόρων Οχημάτων για την Υπηρεσία Ασθενοφόρων","Διαγωνισμός για την Προμήθεια και Συντήρηση Ασθενοφόρων Οχημάτων για την Υπηρεσία Ασθενοφόρων","2021-06-10T14:27:26","2021-08-06T09:00:00","Ανοικτή","Υποβολή Προσφοράς","Πάνω","https://www.eprocurement.gov.cy/epps/cft/downloadNoticeForAdvSearch.do?resourceId=4809201","4320000"
"4809394","2021-06-10T13:00:23.512343","https://www.eprocurement.gov.cy/epps/cft/prepareViewCfTWS.do?resourceId=4809394","Αστυνομία Κύπρου","Δ.Ο 29/2021 Η Προμήθεια και Εγκατάσταση Συστημάτων Προστασίας Κρίσιμων Υποδομών από την Απειλή Μη Επανδρωμένων Πτητικών Μέσων καθώς και η Εκπαίδευση στη χρήση των Συστημάτων","Η Προμήθεια και Εγκατάσταση Συστημάτων Προστασίας Κρίσιμων Υποδομών από την Απειλή Μη Επανδρωμένων Πτητικών Μέσων καθώς και η Εκπαίδευση στη χρήση των Συστημάτων","2021-06-10T15:18:51","2021-07-23T10:00:00","Ανοικτή","Υποβολή Προσφοράς","Πάνω","https://www.eprocurement.gov.cy/epps/cft/downloadNoticeForAdvSearch.do?resourceId=4809394","2171428"
"4809922","2021-06-11T08:00:18.331013","https://www.eprocurement.gov.cy/epps/cft/prepareViewCfTWS.do?resourceId=4809922","Δήμος Λεμεσού","Προσφορά για την προμήθεια και τοποθέτηση πρεσαριστών πινακίδων απο αλουμίνιο με την ονομασία των οδών σε διάφορες περιοχές της Λεμεσού .(39/2021)","Προσφορά για την προμήθεια και τοποθέτηση πρεσαριστών πινακίδων απο αλουμίνιο με την ονομασία των οδών σε διάφορες περιοχές της Λεμεσού .(39/2021)","2021-06-11T10:32:58","2021-07-23T12:00:00","Ανοικτή","Υποβολή Προσφοράς","Κάτω","https://www.eprocurement.gov.cy/epps/cft/downloadNoticeForAdvSearch.do?resourceId=4809922","20000"
"4810074","2021-06-11T08:00:18.331013","https://www.eprocurement.gov.cy/epps/cft/prepareViewCfTWS.do?resourceId=4810074","Αρχή Ηλεκτρισμού Κύπρου","182/2021 - Εκπαιδευτικά Προγράμματα σε Θέματα Ασφαλούς Διαχείρισης Φυσικού Αερίου για Ηλεκτροπαραγωγή","Εκπαιδευτικά Προγράμματα σε Θέματα Ασφαλούς Διαχείρισης Φυσικού Αερίου για Ηλεκτροπαραγωγή","2021-06-11T10:07:34","2021-07-07T23:45:00","Ανοικτή","Υποβολή Προσφοράς","Κάτω","https://www.eprocurement.gov.cy/epps/cft/downloadNoticeForAdvSearch.do?resourceId=4810074","75000"
"4810473","2021-06-11T09:00:19.714896","https://www.eprocurement.gov.cy/epps/cft/prepareViewCfTWS.do?resourceId=4810473","Αρχή Ηλεκτρισμού Κύπρου","224/2021 Supply of cable clips","Supply of cable clips","2021-06-11T11:44:46","2021-07-21T23:45:00","Ανοικτή","Υποβολή Προσφοράς","Κάτω","https://www.eprocurement.gov.cy/epps/cft/downloadNoticeForAdvSearch.do?resourceId=4810473","66000"
"4796423","2021-06-11T09:00:19.714896","https://www.eprocurement.gov.cy/epps/cft/prepareViewCfTWS.do?resourceId=4796423","ΚΟΙΝΟΤΙΚΟ ΣΥΜΒΟΥΛΙΟ ΠΑΧΝΑΣ","ΠΡΟΣΦΟΡΑ ΓΙΑ: ΑΠΟΚΑΤΑΣΤΑΣΗ ΚΑΙ ΑΛΛΑΓΗ ΧΡΗΣΗΣ ΣΧΟΛΙΚΟΥ ΚΤΙΡΙΟΥ ΣΕ ΠΟΛΥΚΕΝΤΡΟ ΝΕΟΛΑΙΑΣ ΣΤΗΝ ΠΑΧΝΑ","ΠΡΟΣΦΟΡΑ ΓΙΑ: ΑΠΟΚΑΤΑΣΤΑΣΗ ΚΑΙ ΑΛΛΑΓΗ ΧΡΗΣΗΣ ΣΧΟΛΙΚΟΥ ΚΤΙΡΙΟΥ ΣΕ ΠΟΛΥΚΕΝΤΡΟ ΝΕΟΛΑΙΑΣ ΣΤΗΝ ΠΑΧΝΑ","2021-06-11T11:24:56","2021-07-02T09:00:00","Ανοικτή","Υποβολή Προσφοράς","Κάτω","https://www.eprocurement.gov.cy/epps/cft/downloadNoticeForAdvSearch.do?resourceId=4796423","247712.5"
"4808986","2021-06-11T09:00:19.714896","https://www.eprocurement.gov.cy/epps/cft/prepareViewCfTWS.do?resourceId=4808986","ΣΧΟΛΙΚΗ ΕΦΟΡΕΙΑ ΠΑΡΑΛΙΜΝΙΟΥ","ΣΥΝΤΗΡΗΣΗ Γ΄ ΔΗΜΟΤΙΚΟΥ ΣΧΟΛΕΙΟΥ ΠΑΡΑΛΙΜΝΙΟΥ","ΣΥΝΤΗΡΗΣΗ Γ΄ ΔΗΜΟΤΙΚΟΥ ΣΧΟΛΕΙΟΥ ΠΑΡΑΛΙΜΝΙΟΥ","2021-06-11T11:24:04","2021-07-02T12:00:00","Ανοικτή","Υποβολή Προσφοράς","Κάτω","https://www.eprocurement.gov.cy/epps/cft/downloadNoticeForAdvSearch.do?resourceId=4808986","49870"
"4810649","2021-06-11T09:00:19.714896","https://www.eprocurement.gov.cy/epps/cft/prepareViewCfTWS.do?resourceId=4810649","ΚΟΙΝΟΤΙΚΟ ΣΥΜΒΟΥΛΙΟ ΕΠΤΑΓΩΝΙΑΣ","ΔΙΑΓΩΝΙΣΜΟΣ ΓΙΑ ΤΗΝ ΠΑΡΟΧΗ ΥΠΗΡΕΣΙΩΝ ΓΙΑ ΤΗΝ ΑΠΟΚΟΜΙΔΗ ΜΕΤΑΦΟΡΑ ΚΑΙ ΑΠΟΡΡΙΨΗ ΣΚΥΒΑΛΛΩΝ ΤΟΥ ΣΥΜΠΛΕΓΜΑΤΟΣ ΚΟΙΝΟΤΗΤΩΝ ΑΚΑΠΝΟΥΣ – ΔΙΕΡΩΝΑΣ - ΕΠΤΑΓΩΝΙΑΣ – ΚΕΛΛΑΚΙΟΥ – ΚΛΩΝΑΡΙΟΥ – ΠΡΑΣΤΕΙΟΥ ΚΕΛΛΑΚΙΟΥ – ΣΑΝΙ","ΔΙΑΓΩΝΙΣΜΟΣ ΓΙΑ ΤΗΝ ΠΑΡΟΧΗ ΥΠΗΡΕΣΙΩΝ ΓΙΑ ΤΗΝ ΑΠΟΚΟΜΙΔΗ ΜΕΤΑΦΟΡΑ ΚΑΙ ΑΠΟΡΡΙΨΗ ΣΚΥΒΑΛΛΩΝ ΤΟΥ ΣΥΜΠΛΕΓΜΑΤΟΣ ΚΟΙΝΟΤΗΤΩΝ ΑΚΑΠΝΟΥΣ – ΔΙΕΡΩΝΑΣ - ΕΠΤΑΓΩΝΙΑΣ – ΚΕΛΛΑΚΙΟΥ – ΚΛΩΝΑΡΙΟΥ – ΠΡΑΣΤΕΙΟΥ ΚΕΛΛΑΚΙΟΥ – ΣΑΝΙΔΑΣ","2021-06-11T11:08:37","2021-06-25T12:00:00","Ανοικτή","Υποβολή Προσφοράς","Κάτω","https://www.eprocurement.gov.cy/epps/cft/downloadNoticeForAdvSearch.do?resourceId=4810649","84000"
"4811558","2021-06-11T10:00:22.332181","https://www.eprocurement.gov.cy/epps/cft/prepareViewCfTWS.do?resourceId=4811558","Δήμος Αγίας Νάπας","ΠΑΡΟΧΗ ΥΠΗΡΕΣΙΩΝ ΓΕΩΠΟΝΟΥ ΓΙΑ ΤΗΝ ΕΠΙΜΕΛΕΙΑ ΤΩΝ ΔΗΜΟΣΙΩΝ ΧΩΡΩΝ ΠΡΑΣΙΝΟΥ ΚΑΙ ΑΛΛΩΝ ΣΥΝΑΦΩΝ ΕΡΓΑΣΙΩΝ ΣΤΟ ΔΗΜΟ ΑΓΊΑΣ ΝΑΠΑΣ","ΠΑΡΟΧΗ ΥΠΗΡΕΣΙΩΝ ΓΕΩΠΟΝΟΥ ΓΙΑ ΤΗΝ ΕΠΙΜΕΛΕΙΑ ΤΩΝ ΔΗΜΟΣΙΩΝ ΧΩΡΩΝ ΠΡΑΣΙΝΟΥ ΚΑΙ ΑΛΛΩΝ ΣΥΝΑΦΩΝ ΕΡΓΑΣΙΩΝ ΣΤΟ ΔΗΜΟ ΑΓΊΑΣ ΝΑΠΑΣ","2021-06-11T12:58:21","2021-07-02T12:00:00","Ανοικτή","Υποβολή Προσφοράς","Κάτω","https://www.eprocurement.gov.cy/epps/cft/downloadNoticeForAdvSearch.do?resourceId=4811558","36000"
"4811234","2021-06-11T10:00:22.332181","https://www.eprocurement.gov.cy/epps/cft/prepareViewCfTWS.do?resourceId=4811234","Τμήμα Δημοσίων Έργων","Δ.Τ.Δ.Ε. (Ε.Μ. Λ/σού) 36/2021 ΤΟΠΙΚΗ ΚΑΙ ΣΦΡΑΓΙΣΤΙΚΗ ΕΠΙΔΙΟΡΘΩΣΗ ΑΣΦΑΛΤΙΚΟΥ ΟΔΟΣΤΡΩΜΑΤΟΣ (ΠΠΑΤΣΙΕΣ) ΣΤΟΥΣ ΑΥΤΟΚΙΝΗΤΟΔΡΟΜΟΥΣ ΤΗΣ ΕΠΑΡΧΙΑΣ ΛΕΜΕΣΟΥ","ΤΟΠΙΚΗ ΚΑΙ ΣΦΡΑΓΙΣΤΙΚΗ ΕΠΙΔΙΟΡΘΩΣΗ ΑΣΦΑΛΤΙΚΟΥ ΟΔΟΣΤΡΩΜΑΤΟΣ (ΠΠΑΤΣΙΕΣ) ΣΤΟΥΣ ΑΥΤΟΚΙΝΗΤΟΔΡΟΜΟΥΣ ΤΗΣ ΕΠΑΡΧΙΑΣ ΛΕΜΕΣΟΥ","2021-06-11T12:28:13","2021-06-29T11:00:00","Ανοικτή","Υποβολή Προσφοράς","Κάτω","https://www.eprocurement.gov.cy/epps/cft/downloadNoticeForAdvSearch.do?resourceId=4811234","103360"
"4810616","2021-06-11T10:00:22.332181","https://www.eprocurement.gov.cy/epps/cft/prepareViewCfTWS.do?resourceId=4810616","ΙΝΣΤΙΤΟΥΤΟ ΚΥΠΡΟΥ","Προμήθεια, τοποθέτηση, εγκατάσταση και συντήρηση ανελκυστήρα στο κτίριο FRESNEL του Ινστιτούτου Κύπρου","Προμήθεια, τοποθέτηση, εγκατάσταση και συντήρηση ανελκυστήρα στο κτίριο FRESNEL του Ινστιτούτου Κύπρου","2021-06-11T12:03:42","2021-07-02T12:00:00","Ανοικτή","Υποβολή Προσφοράς","Κάτω","https://www.eprocurement.gov.cy/epps/cft/downloadNoticeForAdvSearch.do?resourceId=4810616","25000"
"4811523","2021-06-11T12:00:22.303293","https://www.eprocurement.gov.cy/epps/cft/prepareViewCfTWS.do?resourceId=4811523","Τμήμα Αναπτύξεως Υδάτων","ΤΑΥ 19/2021 ΠΡΟΜΗΘΕΙΑ ΧΕΙΡΟΚΙΝΗΤΩΝ ΦΛΑΝΤΖΩΤΩΝ ΔΙΚΛΙΔΩΝ ΚΑΙ ΒΑΛΒΙΔΩΝ ΤΥΠΟΥ ΠΕΤΑΛΟΥΔΑΣ ΓΙΑ ΤΙΣ ΑΝΑΓΚΕΣ ΤΗΣ ΥΠΗΡ. ΛΕΙΤ. ΚΑΙ ΣΥΝΤ., ΤΟΥ ΕΠ. ΑΜΜΟΧΩΣΤΟΥ, ΤΟΥ ΕΠ. ΛΑΡΝΑΚΑΣ ΚΑΙ ΓΙΑ ΤΟ ΝΕΟ ΑΝΤΛ. ΤΕΡΣΕΦΑΝΟΥ","ΠΡΟΜΗΘΕΙΑ ΧΕΙΡΟΚΙΝΗΤΩΝ ΦΛΑΝΤΖΩΤΩΝ ΔΙΚΛΙΔΩΝ ΚΑΙ ΒΑΛΒΙΔΩΝ ΤΥΠΟΥ ΠΕΤΑΛΟΥΔΑΣ ΓΙΑ ΤΙΣ ΑΝΑΓΚΕΣ ΤΗΣ ΥΠΗΡΕΣΙΑΣ ΛΕΙΤΟΥΡΓΙΑΣ ΚΑΙ ΣΥΝΤΗΡΗΣΗΣ, ΤΟΥ ΕΠΑΡΧΙΑΚΟΥ ΑΜΜΟΧΩΣΤΟΥ, ΤΟΥ ΕΠΑΡΧΙΑΚΟΥ ΛΑΡΝΑΚΑΣ ΚΑΙ ΓΙΑ ΔΙΑΣΥΝΔΕΣΗ ΤΟΥ ΝΕΟΥ ΑΝΤΛΙΟΣΤΑΣΙΟΥ ΤΕΡΣΕΦΑΝΟΥ","2021-06-11T14:46:08","2021-07-06T10:00:00","Ανοικτή","Υποβολή Προσφοράς","Κάτω","https://www.eprocurement.gov.cy/epps/cft/downloadNoticeForAdvSearch.do?resourceId=4811523","125070"
"4811485","2021-06-11T12:00:22.303293","https://www.eprocurement.gov.cy/epps/cft/prepareViewCfTWS.do?resourceId=4811485","Υπουργείο Μεταφορών Επικοινωνιών και Έργων","Κατασκευή Πεδίου Προσγείωσης Ελικοπτέρων για σκοπούς Έρευνας - Διάσωσης","Κατασκευή Πεδίου Προσγείωσης Ελικοπτέρων εντός της Ναυτικής Βάσης 'Ευάγγελος Φλωράκης' στο Μαρί.","2021-06-11T14:42:22","2021-06-29T10:00:00","Ανοικτή","Υποβολή Προσφοράς","Κάτω","https://www.eprocurement.gov.cy/epps/cft/downloadNoticeForAdvSearch.do?resourceId=4811485","118000"
