id,updateDate,link,category,description,description2,publishDate,deadlineDate,procedure,cat2,cat3,link2,value
"4857460","2021-07-08T06:00:21.807392","https://www.eprocurement.gov.cy/epps/cft/prepareViewCfTWS.do?resourceId=4857460","Συμβούλιο Υδατοπρομήθειας Λάρνακας","ΣΥΛ 11/2021 Κατασκευή Νέας Υδατοδεξαμενής στα Κλαυδιά","ΣΥΛ 11/2021 Κατασκευή Νέας Υδατοδεξαμενής στα Κλαυδιά","2021-07-08T08:46:01","2021-08-30T12:00:00","Ανοικτή","Υποβολή Προσφοράς","Κάτω","https://www.eprocurement.gov.cy/epps/cft/downloadNoticeForAdvSearch.do?resourceId=4857460","3000000"
"4856949","2021-07-08T07:00:20.969499","https://www.eprocurement.gov.cy/epps/cft/prepareViewCfTWS.do?resourceId=4856949","Οργανισμός Κρατικών Υπηρεσιών Υγείας","ΔΙΑΓΩΝΙΣΜΟΣ ΓΙΑ ΤΗ ΠΡΟΜΗΘΕΙΑ ΥΛΙΚΟΥ ΠΕΡΙΤΥΛΙΓΜΑΤΟΣ ΓΙΑ ΤΙΣ ΑΝΑΓΚΕΣ ΤΩΝ ΤΜΗΜΑΤΩΝ ΚΕΝΤΡΙΚΗΣ ΑΠΟΣΤΕΙΡΩΣΗΣ ΤΩΝ ΝΟΣΗΛΕΥΤΗΡΙΩΝ ΤΟΥ Ο.Κ.Υπ.Υ. Σ.Υ.30/21","ΔΙΑΓΩΝΙΣΜΟΣ ΓΙΑ ΤΗ ΠΡΟΜΗΘΕΙΑ ΥΛΙΚΟΥ ΠΕΡΙΤΥΛΙΓΜΑΤΟΣ ΓΙΑ ΤΙΣ ΑΝΑΓΚΕΣ ΤΩΝ ΤΜΗΜΑΤΩΝ ΚΕΝΤΡΙΚΗΣ ΑΠΟΣΤΕΙΡΩΣΗΣ ΤΩΝ ΝΟΣΗΛΕΥΤΗΡΙΩΝ ΤΟΥ Ο.Κ.Υπ.Υ. Σ.Υ.30/21","2021-07-08T09:38:25","2021-08-09T10:00:00","Ανοικτή","Υποβολή Προσφοράς","Πάνω","https://www.eprocurement.gov.cy/epps/cft/downloadNoticeForAdvSearch.do?resourceId=4856949","516626"
"4858264","2021-07-08T07:00:20.969499","https://www.eprocurement.gov.cy/epps/cft/prepareViewCfTWS.do?resourceId=4858264","Τμήμα Δημοσίων Έργων","ΠΡΟΜΗΘΕΙΑ, ΜΕΤΑΦΟΡΑ, ΠΑΡΑΔΟΣΗ, ΕΚΦΟΡΤΩΣΗ, ΣΥΝΑΡΜΟΛΟΓΗΣΗ ΚΑΙ ΕΓΚΑΤΑΣΤΑΣΗ ΠΡΟΚΑΤΑΣΚΕΥΑΣΜΕΝΩΝ ΥΠΟΣΤΑΤΙΚΩΝ ΓΙΑ ΤΙΣ ΚΕΝΤΡΙΚΕΣ ΦΥΛΑΚΕΣ ΑΡ. ΔΙΑΓΩΝΙΣΜΟΥ: Δ.Τ.Δ.Ε. (Ε.Μ.Λ/σίας) 29/2021","ΠΡΟΜΗΘΕΙΑ, ΜΕΤΑΦΟΡΑ, ΠΑΡΑΔΟΣΗ, ΕΚΦΟΡΤΩΣΗ, ΣΥΝΑΡΜΟΛΟΓΗΣΗ ΚΑΙ ΕΓΚΑΤΑΣΤΑΣΗ ΠΡΟΚΑΤΑΣΚΕΥΑΣΜΕΝΩΝ ΥΠΟΣΤΑΤΙΚΩΝ ΓΙΑ ΤΙΣ ΚΕΝΤΡΙΚΕΣ ΦΥΛΑΚΕΣ","2021-07-08T09:22:45","2021-07-22T12:00:00","Ανοικτή","Υποβολή Προσφοράς","Κάτω","https://www.eprocurement.gov.cy/epps/cft/downloadNoticeForAdvSearch.do?resourceId=4858264","136000"
"4858164","2021-07-08T07:00:20.969499","https://www.eprocurement.gov.cy/epps/cft/prepareViewCfTWS.do?resourceId=4858164","Αρχή Ηλεκτρισμού Κύπρου","234/2021 - Supply of Cable Rollers and Cable Laying Accessories","Supply of Cable Rollers and Cable Laying Accessories","2021-07-08T09:16:25","2021-08-11T23:45:00","Ανοικτή","Υποβολή Προσφοράς","Κάτω","https://www.eprocurement.gov.cy/epps/cft/downloadNoticeForAdvSearch.do?resourceId=4858164","40000"
"4857021","2021-07-08T09:00:18.838101","https://www.eprocurement.gov.cy/epps/cft/prepareViewCfTWS.do?resourceId=4857021","Υπουργείο Παιδείας Πολιτισμού Αθλητισμού και Νεολαίας","ΜΕΤΑΚΙΝΗΣΗ ΤΟΠΟΘΕΤΗΣΗ ΚΑΙ ΕΠΙΣΚΕΥΗ ΠΡΟΚΑΤΑΣΚΕΥΑΣΜΕΝΩΝ ΑΙΘΟΥΣΩΝ ΣΕ ΣΧΟΛΙΚΕΣ ΜΟΝΑΔΕΣ ΠΑΓΚΥΠΡΙΑ (Τ.Υ. 46/2021)","α) Αφορά την μετακίνηση και τοποθέτηση 115± 20 Προκατασκευασμένων Αιθουσών, διαστάσεων 8.5 χ 7 μ, 25 ± 5 Προκατασκευασμένων Αιθουσών διαστάσεων 3.5 χ 8.5 μ και 7 ± 2 Προκατασκευασμένων Αιθουσών διαστάσεων 10.5 χ 8.5μ σε Παγκύπρια Κλίμακα και β) Την επισκευή των προκατασκευασμένων αιθουσών Παγκύπρια. Αρ. Διαγωνισμού: Τ.Υ. 46/2021","2021-07-08T11:31:21","2021-08-06T09:00:00","Ανοικτή","Υποβολή Προσφοράς","Κάτω","https://www.eprocurement.gov.cy/epps/cft/downloadNoticeForAdvSearch.do?resourceId=4857021","453385"
"4858707","2021-07-08T09:00:18.838101","https://www.eprocurement.gov.cy/epps/cft/prepareViewCfTWS.do?resourceId=4858707","ΕΠΑΡΧΙΑΚΗ ΔΙΟΙΚΗΣΗ ΠΑΦΟΥ","Α) ΠΡΟΜΗΘΕΙΑ, ΜΕΤΑΦΟΡΑ ΚΑΙ ΕΠΙΣΤΡΩΣΗ ΑΣΦΑΛΤΙΚΟΥ ΣΚΥΡΟΔΕΜΑΤΟΣ Β) ΑΦΑΙΡΕΣΗ, ΑΠΟΜ/ΝΣΗ ,ΠΡΟΜΗΘΕΙΑ, ΜΕΤ/ΡΑ ΚΑΙ ΤΟΠ/ΤΗΣΗ ΑΣΦΑΛΤ. ΣΚΥΡ/ΤΟΣ (ΠΡΕΜΙΞ) ΓΙΑ ΤΙΣ ΑΝΑΓΚΕΣ ΤΗΣ ΕΠ. ΔΙΟΙΚ. ΠΑΦΟΥ (ΠΕΡ/ΧΕΣ Α,Β)-ΤΣ29/21","Από το Γραφείο της Επάρχου Πάφου, ζητούνται προσφορές για: α) Προμήθεια, Μεταφορά και Επίστρωση ασφαλτικού σκυροδέματος (Πρέμιξ) β) Αφαίρεση – απομάκρυνση και προμήθεια, μεταφορά και τοποθέτηση ασφαλτικού σκυροδέματος (Πρέμιξ) για τις ανάγκες της Επαρχιακής Διοίκησης Πάφου (Περιοχές Α, Β) όπως αυτές καθορίζονται στους όρους του διαγωνισμού- Αρ.Πρ. Ε.Δ. ΠΑΦ. ΤΣ29/2021. Η Κατηγορία και τάξη του Έργου είναι Τεχνικό Γ′ Τάξης. Οι προσφορές θα υποβάλλονται ηλεκτρονικά (όχι σε φάκελο), μέσω του eProcurement στην ιστοσελίδα www.eprocurement.gov.cy μέχρι την Παρασκευή 30 Ιουλίου 2021 και ώρα 09:00 π.μ. Από την ίδια ιστοσελίδα μπορούν να εξασφαλιστούν ΔΩΡΕΑΝ πλήρη σειρά των Εγγράφων στην οποία περιέχονται όλες οι πληροφορίες του διαγωνισμού. Για τυχόν τεχνική υποστήριξη τηλ.22605050. Για περισσότερες πληροφορίες οι ενδιαφερόμενοι μπορούν να απευθύνονται στα Γραφεία της Επαρχιακής Διοίκησης Πάφου, Τεχνικές Υπηρεσίες τηλ. 26801137, 26801207, 26801205, 26801159, 26801188 Φαξ:26801172","2021-07-08T11:22:48","2021-07-30T09:00:00","Ανοικτή","Υποβολή Προσφοράς","Κάτω","https://www.eprocurement.gov.cy/epps/cft/downloadNoticeForAdvSearch.do?resourceId=4858707","447450"
"4858442","2021-07-08T09:00:18.838101","https://www.eprocurement.gov.cy/epps/cft/prepareViewCfTWS.do?resourceId=4858442","Υπουργείο Υγείας","Προσφορά για την προμήθεια Πεγκυλιωμένης Ιντερφερόνης Άλφα, Φ.Υ.Υ.78/2021(ΥΥ-ΟΑΥ)","Προμήθεια Πεγκυλιωμένης Ιντερφερόνης Άλφα","2021-07-08T11:06:02","2021-08-05T13:00:00","Ανοικτή","Υποβολή Προσφοράς","Κάτω","https://www.eprocurement.gov.cy/epps/cft/downloadNoticeForAdvSearch.do?resourceId=4858442","129168"
"4859359","2021-07-08T11:00:20.819397","https://www.eprocurement.gov.cy/epps/cft/prepareViewCfTWS.do?resourceId=4859359","Δήμος Ιδαλίου","ΔΙΑΓΩΝΙΣΜΟΣ ΑΡ.10/2021-ΠΡΟΜΗΘΕΙΑ ΚΑΙ ΕΦΑΡΜΟΓΗ ΑΝΤΑΝΑΚΛΑΣΤΙΚΗΣ ΘΕΡΜΟΠΛΑΣΤΙΚΗΣ ΜΠΟΓΙΑΣ ΣΗΜΑΝΣΗΣ ΔΡΟΜΩΝ ΓΙΑ ΓΡΑΜΜΕΣ ΤΟΠΟΘΕΤΗΣΗΣ/ΑΝΤΙΚΑΤΑΣΤΑΣΗΣ ΠΙΝΑΚΙΔΩΝ ΣΗΜΑΝΣΗΣ ΣΤΟΥΣ ΑΥΤΟΚΙΝΗΤΟΔΡΟΜΟΥΣ ΤΟΥ ΔΗΜΟΥ ΙΔΑΛΙΟΥ","ΔΙΑΓΩΝΙΣΜΟΣ ΑΡ.10/2021-ΠΡΟΜΗΘΕΙΑ ΚΑΙ ΕΦΑΡΜΟΓΗ ΑΝΤΑΝΑΚΛΑΣΤΙΚΗΣ ΘΕΡΜΟΠΛΑΣΤΙΚΗΣ ΜΠΟΓΙΑΣ ΣΗΜΑΝΣΗΣ ΔΡΟΜΩΝ ΓΙΑ ΓΡΑΜΜΕΣ ΤΟΠΟΘΕΤΗΣΗΣ/ΑΝΤΙΚΑΤΑΣΤΑΣΗΣ ΠΙΝΑΚΙΔΩΝ ΣΗΜΑΝΣΗΣ ΣΤΟΥΣ ΑΥΤΟΚΙΝΗΤΟΔΡΟΜΟΥΣ ΤΟΥ ΔΗΜΟΥ ΙΔΑΛΙΟΥ","2021-07-08T13:56:59","2021-08-31T11:00:00","Ανοικτή","Υποβολή Προσφοράς","Κάτω","https://www.eprocurement.gov.cy/epps/cft/downloadNoticeForAdvSearch.do?resourceId=4859359","100000"
"4859163","2021-07-08T11:00:20.819397","https://www.eprocurement.gov.cy/epps/cft/prepareViewCfTWS.do?resourceId=4859163","Δήμος Αθηένου","'Κατασκευή τοίχου αντιστήριξης στην περιοχή Καφούντας στον Δήμο Αθηένου', αρ. διαγωνισμού 17/2021.","'Κατασκευή τοίχου αντιστήριξης στην περιοχή Καφούντας στον Δήμο Αθηένου', αρ. διαγωνισμού 17/2021.","2021-07-08T13:10:54","2021-07-30T12:00:00","Ανοικτή","Υποβολή Προσφοράς","Κάτω","https://www.eprocurement.gov.cy/epps/cft/downloadNoticeForAdvSearch.do?resourceId=4859163","30000"
"4859468","2021-07-08T12:00:16.855314","https://www.eprocurement.gov.cy/epps/cft/prepareViewCfTWS.do?resourceId=4859468","Υπουργείο Παιδείας Πολιτισμού Αθλητισμού και Νεολαίας","Προμήθεια Εξοπλισμού Εργαστηρίων Φυσικής ΜΓΕ (ME 05-21)","Ο διαγωνισμός αφορά την προμήθεια: (α) αναλώσιμων ειδών που απαιτούνται για την διδασκαλία του μαθήματος, και (β) συσκευών και οργάνων για αντικατάσταση αντίστοιχων χαλασμένων ή/και φθαρμένων","2021-07-08T14:41:55","2021-08-02T11:00:00","Ανοικτή","Υποβολή Προσφοράς","Κάτω","https://www.eprocurement.gov.cy/epps/cft/downloadNoticeForAdvSearch.do?resourceId=4859468","50200"
"4848335","2021-07-08T12:00:16.855314","https://www.eprocurement.gov.cy/epps/cft/prepareViewCfTWS.do?resourceId=4848335","Δήμος Λεμεσού","Προσφορά για παροχή υπηρεσιών γαι το σχεδιασμό χριστουγεννιάτικου διάκοσμου συμπεριλαμβανομένης συντήρησης, κατασκευής ,τοποθέτησης, αφαίρεσης ,αποθήκευσης του διάκοσμού. (49/2021)","Προσφορά για παροχή υπηρεσιών γαι το σχεδιασμό χριστουγεννιάτικου διάκοσμου συμπεριλαμβανομένης συντήρησης, κατασκευής ,τοποθέτησης, αφαίρεσης ,αποθήκευσης του διάκοσμού. (49/2021)","2021-07-08T14:30:35","2021-07-29T12:00:00","Ανοικτή","Υποβολή Προσφοράς","Κάτω","https://www.eprocurement.gov.cy/epps/cft/downloadNoticeForAdvSearch.do?resourceId=4848335","130000"
"4847840","2021-07-08T12:00:16.855314","https://www.eprocurement.gov.cy/epps/cft/prepareViewCfTWS.do?resourceId=4847840","Δήμος Λεμεσού","Προσφορά για παροχή υπηρεσιών για το στολισμό δέντρων με φωτεινές γιρλάντες για τα χριστούγεννα. (50/2021)","Προσφορά για παροχή υπηρεσιών για το στολισμό δέντρων με φωτεινές γιρλάντες για τα χριστούγεννα συμπεριλαμβανομένης συντήρησης ,τοποθέτησης,αφαίρεσης,αποθήκευσης του διάκοσμου.","2021-07-08T14:16:05","2021-07-29T12:00:00","Ανοικτή","Υποβολή Προσφοράς","Κάτω","https://www.eprocurement.gov.cy/epps/cft/downloadNoticeForAdvSearch.do?resourceId=4847840","60000"
"4860219","2021-07-09T07:00:22.156317","https://www.eprocurement.gov.cy/epps/cft/prepareViewCfTWS.do?resourceId=4860219","Δήμος Λεμεσού","Προσφορά για την παροχή υπηρεσίων για καθάρισμα δημόσιων αποχωρητηρίων. (54/2021)","Προσφορά για την παροχή υπηρεσίων για καθάρισμα δημόσιων αποχωρητηρίων.","2021-07-09T09:46:20","2021-08-13T12:00:00","Ανοικτή","Υποβολή Προσφοράς","Πάνω","https://www.eprocurement.gov.cy/epps/cft/downloadNoticeForAdvSearch.do?resourceId=4860219","420000"
"4858235","2021-07-09T08:00:18.234741","https://www.eprocurement.gov.cy/epps/cft/prepareViewCfTWS.do?resourceId=4858235","Τμήμα Δημοσίων Έργων","Κατασκευή του Οδικού Δικτύου στην Περιοχή του Νέου Σταδίου ποδοσφαίρου στο Κολόσσι και του Οδικού Δικτύου Σύνδεσης με το Εθνικό Οδικό Δίκτυο, Αρ. Διαγωνισμού: ΚΠΣ/16/2021/Ε(Α)","Το Έργο βρίσκεται στην επαρχία Λεμεσού και συγκεκριμένα περιλαμβάνει τη Λεωφόρο Σπύρου Κυπριανού, την οδό Τάσου Ισαάκ και τέσσερις νέες ράμπες από και προς τον αυτοκινητόδρομο (Α6) σύμφωνα με τα κατασκευαστικά σχέδια. Tο Έργο αφορά τη βελτίωση / ανακατασκευή του οδικού δικτύου στην περιοχή του νέου σταδίου ποδοσφαίρου στο Κολόσσι, τη δημιουργία ραμπών εισόδου/εξόδου από και προς το Εθνικό Οδικό Δίκτυο, καθώς και τη δημιουργία τριών νέων κυκλικών κόμβων.","2021-07-09T10:34:52","2021-09-17T11:00:00","Ανοικτή","Υποβολή Προσφοράς","Πάνω","https://www.eprocurement.gov.cy/epps/cft/downloadNoticeForAdvSearch.do?resourceId=4858235","8400000"
"4860598","2021-07-09T09:00:21.497653","https://www.eprocurement.gov.cy/epps/cft/prepareViewCfTWS.do?resourceId=4860598","Υπουργείο Άμυνας","Προμήθεια 40 υπολογιστών αφής (Rugged Tablets)","Διαγωνισμός για την προμήθεια 40 υπολογιστών αφής (Rugged Tablets) και παρελκομένων τους","2021-07-09T11:56:11","2021-09-08T09:00:00","Ανοικτή","Υποβολή Προσφοράς","Πάνω","https://www.eprocurement.gov.cy/epps/cft/downloadNoticeForAdvSearch.do?resourceId=4860598","162000"
"4861149","2021-07-09T09:00:21.497653","https://www.eprocurement.gov.cy/epps/cft/prepareViewCfTWS.do?resourceId=4861149","ΕΦΟΡΕΙΑ ΕΛΛΗΝΙΚΩΝ ΕΚΠΑΙΔΕΥΤΗΡΙΩΝ ΛΑΡΝΑΚΑΣ","Πλειοδοτικός Διαγωνισμός για Διαχείριση και Εκμετάλλευση του Κυλικείου στο Δημοτικό Σχολείο Αγίων Αναργύρων 'Μιχάλης Κακογιάννης' Λάρνακας","Διαχείριση και Εκμετάλλευση του Κυλικείου στο Δημοτικό Σχολείο Αγίων Αναργύρων 'Μιχάλης Κακογιάννης' στη Λάρνακα","2021-07-09T11:54:05","2021-07-30T12:00:00","Ανοικτή","Υποβολή Προσφοράς","Κάτω","https://www.eprocurement.gov.cy/epps/cft/downloadNoticeForAdvSearch.do?resourceId=4861149","25608"
"4860996","2021-07-09T09:00:21.497653","https://www.eprocurement.gov.cy/epps/cft/prepareViewCfTWS.do?resourceId=4860996","Υπουργείο Εσωτερικών","Ανάπτυξη εφαρμογής και φιλοξενία σε κέντρα δεδομένων","Το αντικείμενο της σύμβασης αφορά την Ανάπτυξη εφαρμογής διαχείρισης μητρώου Μη Κυβερνητικών Οργανισμών (ΜΚΟ) και μητρώου πραγματικών δικαιούχων και φύλαξη των δεδομένων σε κέντρα δεδομένων στην Κυπριακή Δημοκρατία, περιλαμβανομένων αναβαθμίσεων, συντήρησης και λειτουργικής υποστήριξης για περίοδο πέντε ετών μετά την παραλαβή της εφαρμογής.","2021-07-09T11:45:55","2021-08-30T12:00:00","Ανοικτή","Υποβολή Προσφοράς","Πάνω","https://www.eprocurement.gov.cy/epps/cft/downloadNoticeForAdvSearch.do?resourceId=4860996","160000"
"4858972","2021-07-09T09:00:21.497653","https://www.eprocurement.gov.cy/epps/cft/prepareViewCfTWS.do?resourceId=4858972","Τμήμα Μετεωρολογίας","The supply, of a Meteorological Data, Visualization, Monitoring and Publishing Software System.","The supply, of a Meteorological Data, Visualization, Monitoring and Publishing Software System.","2021-07-09T11:36:27","2021-08-16T23:00:00","Ανοικτή","Υποβολή Προσφοράς","Πάνω","https://www.eprocurement.gov.cy/epps/cft/downloadNoticeForAdvSearch.do?resourceId=4858972","200000"
"4861282","2021-07-09T09:00:21.497653","https://www.eprocurement.gov.cy/epps/cft/prepareViewCfTWS.do?resourceId=4861282","Αρχή Ηλεκτρισμού Κύπρου","147/2021 - Supply of Fuse Links","Supply of Fuse Links","2021-07-09T11:33:38","2021-08-25T12:00:00","Ανοικτή","Υποβολή Προσφοράς","Κάτω","https://www.eprocurement.gov.cy/epps/cft/downloadNoticeForAdvSearch.do?resourceId=4861282","183000"
"4860913","2021-07-09T09:00:21.497653","https://www.eprocurement.gov.cy/epps/cft/prepareViewCfTWS.do?resourceId=4860913","Τμήμα Δημοσίων Έργων","Δ.Τ.Δ.Ε. (Ε.Μ. Λ/ΣΟΥ) 40/2021 ΕΝΟΙΚΙΑΣΗ ΑΠΟΡΡΙΜΑΤΟΚΙΒΩΤΙΩΝ/ΚΑΔΩΝ ΑΠΟΡΡΙΨΗΣ ΣΤΕΡΕΩΝ ΑΠΟΒΛΗΤΩΝ (SKIP) ΓΙΑ ΤΙΣ ΑΝΑΓΚΕΣ ΤΟΥ ΓΡΑΦΕΙΟΥ ΤΟΥ ΕΠΑΡΧΙΑΚΟΥ ΜΗΧΑΝΙΚΟΥ ΔΗΜΟΣΙΩΝ ΕΡΓΩΝ ΛΕΜΕΣΟΥ","ΕΝΟΙΚΙΑΣΗ ΑΠΟΡΡΙΜΑΤΟΚΙΒΩΤΙΩΝ/ΚΑΔΩΝ ΑΠΟΡΡΙΨΗΣ ΣΤΕΡΕΩΝ ΑΠΟΒΛΗΤΩΝ (SKIP) ΓΙΑ ΤΙΣ ΑΝΑΓΚΕΣ ΤΟΥ ΓΡΑΦΕΙΟΥ ΤΟΥ ΕΠΑΡΧΙΑΚΟΥ ΜΗΧΑΝΙΚΟΥ ΔΗΜΟΣΙΩΝ ΕΡΓΩΝ ΛΕΜΕΣΟΥ","2021-07-09T11:32:32","2021-07-30T11:00:00","Ανοικτή","Υποβολή Προσφοράς","Κάτω","https://www.eprocurement.gov.cy/epps/cft/downloadNoticeForAdvSearch.do?resourceId=4860913","15000"
"4861812","2021-07-09T10:00:18.143648","https://www.eprocurement.gov.cy/epps/cft/prepareViewCfTWS.do?resourceId=4861812","ΕΦΟΡΕΙΑ ΕΛΛΗΝΙΚΩΝ ΕΚΠΑΙΔΕΥΤΗΡΙΩΝ ΛΑΡΝΑΚΑΣ","Πλειοδοτικός Διαγωνισμός για Διαχείριση και Εκμετάλλευση του Κυλικείου στο Δημοτικό Σχολείο 'ΖΗΝΩΝ' Λάρνακας","Διαχείριση και Εκμετάλλευση του Κυλικείου στο Δημοτικό Σχολείο 'ΖΗΝΩΝ' Λάρνακας","2021-07-09T12:41:49","2021-07-30T12:00:00","Ανοικτή","Υποβολή Προσφοράς","Κάτω","https://www.eprocurement.gov.cy/epps/cft/downloadNoticeForAdvSearch.do?resourceId=4861812","35000"
"4861223","2021-07-09T11:00:17.972753","https://www.eprocurement.gov.cy/epps/cft/prepareViewCfTWS.do?resourceId=4861223","Δήμος Πέγειας","ΠΡΟΣΦΟΡΑ ΓΙΑ ΑΣΦΑΛΤΟΣΤΡΩΣΗ ΚΑΙ ΕΠΑΛΕΙΨΗ ΔΡΟΜΩΝ ΕΝΤΟΣ ΤΩΝ ΔΗΜΟΤΙΚΩΝ ΟΡΙΩΝ ΔΗΜΟΥ ΠΕΓΕΙΑΣ","Ασφαλτόστρωση και επάλειψη δρόμων εντός των Δημοτικών Ορίων Δήμου Πέγειας: α)Αφαίρεση και απομάκρυνση επιφανειακής στρώσης (Surface course) ασφαλτικού σκυροδέματος (πρέμιξ) πάχους τουλάχιστον 5εκ. (β) Εκσκαφή, Απομάκρυνση και Φορμάρισμα σε πάχος 20cm. (γ) Προμήθεια, μεταφορά, τοποθέτηση και συμπίεση θεμελίου πάχους τουλάχιστον 15εκ. (συμπιεσμένο),σύμφωνα με τους όρους των εγγράφων του διαγωνισμού. (δ) Προμήθεια, μεταφορά, τοποθέτηση και συμπίεση συνδετικής στρώσης (Base course) AC20 ασφαλτικού σκυροδέματος (πρέμιξ), πάχους τουλάχιστον 7εκ. , σύμφωνα με τους όρους των εγγράφων του διαγωνισμού. (ε) Προμήθεια, μεταφορά, τοποθέτηση και συμπίεση επιφανειακής στρώσης (Surface course) AC14 ασφαλτικού σκυροδέματος (πρέμιξ) πάχους τουλάχιστον 5εκ. , σύμφωνα με τους όρους των εγγράφων του διαγωνισμού. (στ) Επαναφορά υφιστάμενων φρεατίων ή σχαρών άλλων Τμημάτων/Υπηρεσιών στο νέο τελικό υψόμετρο της Ασφαλτόστρωσης.","2021-07-09T13:17:24","2021-09-17T12:00:00","Ανοικτή","Υποβολή Προσφοράς","Κάτω","https://www.eprocurement.gov.cy/epps/cft/downloadNoticeForAdvSearch.do?resourceId=4861223","830000"
"4862041","2021-07-09T12:00:20.575032","https://www.eprocurement.gov.cy/epps/cft/prepareViewCfTWS.do?resourceId=4862041","ΔΗΜΟΣ ΛΑΤΣΙΩΝ","ΔΛΠ 3/2021, Διαγωνισμός για Συντήρηση του Ασφαλτικού Οδοστρώματος Οδών στον Δήμο Λατσιών","Ανοικτός διαγωνισμός με υποβολή προσφορών στο Ηλ. Σύστημα, για τη συντήρηση της ασφαλτόστρωσης σε οδούς στον Δήμο Λατσιών.","2021-07-09T14:41:48","2021-07-30T14:15:00","Ανοικτή","Υποβολή Προσφοράς","Κάτω","https://www.eprocurement.gov.cy/epps/cft/downloadNoticeForAdvSearch.do?resourceId=4862041","500000"
"4862157","2021-07-09T12:00:20.575032","https://www.eprocurement.gov.cy/epps/cft/prepareViewCfTWS.do?resourceId=4862157","Αρχή Ηλεκτρισμού Κύπρου","153/2021 - Εκσκαφή σκαμμάτων και άλλων συναφών εργασιών για την τοποθέτηση υπόγειων καλωδίων χαμηλής (ΧΤ) και μέσης τάσης (ΜΤ)","Εκσκαφή σκαμμάτων και άλλων συναφών εργασιών για την τοποθέτηση υπόγειων καλωδίων χαμηλής (ΧΤ) και μέσης τάσης (ΜΤ)","2021-07-09T14:38:57","2021-09-03T23:45:00","Ανοικτή","Υποβολή Προσφοράς","Πάνω","https://www.eprocurement.gov.cy/epps/cft/downloadNoticeForAdvSearch.do?resourceId=4862157",""
"4862526","2021-07-09T16:00:22.256938","https://www.eprocurement.gov.cy/epps/cft/prepareViewCfTWS.do?resourceId=4862526","ΔΗΜΟΣ ΛΑΤΣΙΩΝ","ΔΛΠ 16/2021, Διαγωνισμός για προμήθεια και εγκατάσταση φωτοβολταϊκού συστήματος στο κτίριο του Δημοτικού Μεγάρου Λατσιών","Ανοικτός διαγωνισμός για λήψη προσφορών με σκοπό την προμήθεια, εγκατάσταση και συντήρηση φωτοβολταϊκού συστήματος επί της οροφής του Δημοτικού Μεγάρου Λατσιών.","2021-07-09T18:43:31","2021-07-30T14:15:00","Ανοικτή","Υποβολή Προσφοράς","Κάτω","https://www.eprocurement.gov.cy/epps/cft/downloadNoticeForAdvSearch.do?resourceId=4862526","85000"
"4862484","2021-07-09T17:00:17.883463","https://www.eprocurement.gov.cy/epps/cft/prepareViewCfTWS.do?resourceId=4862484","ΔΗΜΟΣ ΛΑΤΣΙΩΝ","ΔΛΠ 8/2021, Διαγωνισμός για υλοποίηση του έργου επέκτασης του Δημ. Κοιμητηρίου Λατσιών.","Ανοικτός διαγωνισμός με ηλεκτρ. υποβολή προσφορών για υλοποίηση του έργου επέκτασης του Δημ. Κοιμητηρίου Λατσιών.","2021-07-09T19:42:24","2021-07-30T14:15:00","Ανοικτή","Υποβολή Προσφοράς","Κάτω","https://www.eprocurement.gov.cy/epps/cft/downloadNoticeForAdvSearch.do?resourceId=4862484","200000"
"4862819","2021-07-12T05:00:22.007311","https://www.eprocurement.gov.cy/epps/cft/prepareViewCfTWS.do?resourceId=4862819","Οργανισμός Κρατικών Υπηρεσιών Υγείας","Διαγωνισμός για αγορά σετ στυλεών δειγματοληψίας για τον SARS-CoV-2 για τις ανάγκες του ΟΚΥπΥ Γ.Τ.175/21","Διαγωνισμός για αγορά σετ στυλεών δειγματοληψίας για τον SARS-CoV-2 για τις ανάγκες του ΟΚΥπΥ","2021-07-12T07:54:59","2021-07-29T12:00:00","Ανοικτή","Υποβολή Προσφοράς","Κάτω","https://www.eprocurement.gov.cy/epps/cft/downloadNoticeForAdvSearch.do?resourceId=4862819","210000"
